{
  "schema_version": "0.2.0",
  "track": "foundations",
  "title": {
    "zh-CN": "从零构建 Agent Harness",
    "en": "Build an Agent Harness from Zero"
  },
  "lessons": [
    {
      "id": "s01-agent-loop",
      "number": "01",
      "slug": "agent-loop",
      "title": {"zh-CN": "最小 Agent Loop", "en": "The Minimal Agent Loop"},
      "summary": {"zh-CN": "把一次模型调用变成有明确终止条件的循环。", "en": "Turn one model call into a loop with an explicit stop condition."},
      "mechanism_ids": ["agent-loop"],
      "status": "implemented",
      "estimated_minutes": 22,
      "difficulty": "beginner",
      "code_path": "curriculum/lessons/s01_agent_loop/demo.py",
      "content_paths": {"zh-CN": "curriculum/lessons/s01_agent_loop/lesson.zh.md", "en": "curriculum/lessons/s01_agent_loop/lesson.en.md"},
      "run": "python3 -m curriculum.lessons.s01_agent_loop.demo",
      "change_contract": {
        "previous_lesson_id": null,
        "summary": {"zh-CN": "建立后续所有章节共享的有界循环基线。", "en": "Establish the bounded-loop baseline shared by every later lesson."},
        "adds": [
          {"zh-CN": "显式 session 生命周期与停止原因", "en": "An explicit session lifecycle and stop reason"},
          {"zh-CN": "Model 与 Harness 之间的 provider-neutral 边界", "en": "A provider-neutral boundary between model and harness"}
        ],
        "preserves": [
          {"zh-CN": "只记录可观察行为，不记录隐藏推理。", "en": "Record observable behavior, never hidden reasoning."}
        ]
      },
      "golden_trace": {
        "path": "curriculum/lessons/s01_agent_loop/golden.trace.jsonl",
        "run_id": "run-s01-agent-loop-golden",
        "expected_event_count": 5,
        "focus_event_types": ["session.start", "model.request", "model.response", "session.stop"]
      },
      "agent_bridge": {
        "relationship": "direct",
        "claim_ids": ["codex-source-agent-loop", "pi-source-agent-loop", "reasonix-source-agent-loop"],
        "notes": {"zh-CN": "三份固定源码快照都提供了可核对的 Agent Loop 结构，但产品协议和恢复策略不同。", "en": "Three pinned source snapshots expose inspectable agent-loop structures, while their product protocols and recovery policies differ."}
      },
      "exercise_checks": [
        {
          "id": "s01-golden-trace",
          "level": "observe",
          "title": {"zh-CN": "复核 Golden Trace", "en": "Verify the Golden Trace"},
          "acceptance": {"zh-CN": "提交的 JSONL 与示例真实运行完全一致，并通过 Trace Schema。", "en": "The committed JSONL exactly matches a real demo run and passes the trace schema."},
          "command": "python3 -m curriculum.golden verify s01-agent-loop"
        },
        {
          "id": "s01-loop-contract",
          "level": "modify",
          "title": {"zh-CN": "守住循环不变量", "en": "Preserve loop invariants"},
          "acceptance": {"zh-CN": "正常完成仍产生连续 sequence，并以 session.stop 结束。", "en": "A completed run keeps contiguous sequence numbers and ends with session.stop."},
          "command": "python3 -m unittest curriculum.tests.test_vertical_slice.VerticalSliceTests.test_s01_minimal_loop -v"
        }
      ]
    },
    {
      "id": "s02-events-streaming",
      "number": "02",
      "slug": "events-streaming",
      "title": {"zh-CN": "Streaming 与事件", "en": "Streaming and Events"},
      "summary": {"zh-CN": "把流式增量转换成可观察、可回放的事件。", "en": "Convert streaming deltas into observable, replayable events."},
      "mechanism_ids": ["agent-loop", "event-stream"],
      "status": "implemented",
      "estimated_minutes": 24,
      "difficulty": "beginner",
      "code_path": "curriculum/lessons/s02_events_streaming/demo.py",
      "content_paths": {"zh-CN": "curriculum/lessons/s02_events_streaming/lesson.zh.md", "en": "curriculum/lessons/s02_events_streaming/lesson.en.md"},
      "run": "python3 -m curriculum.lessons.s02_events_streaming.demo",
      "change_contract": {
        "previous_lesson_id": "s01-agent-loop",
        "summary": {"zh-CN": "保持同一循环，把单次响应改造成有序的 streaming delta。", "en": "Keep the same loop while turning one response into ordered streaming deltas."},
        "adds": [
          {"zh-CN": "逐增量 model.response 事件", "en": "One model.response event per delta"},
          {"zh-CN": "累积文本与最终 chunk 标记", "en": "Accumulated text and an explicit final-chunk marker"}
        ],
        "preserves": [
          {"zh-CN": "一次模型 turn 最终仍只追加一条 assistant message。", "en": "One model turn still appends exactly one assistant message."}
        ]
      },
      "golden_trace": {
        "path": "curriculum/lessons/s02_events_streaming/golden.trace.jsonl",
        "run_id": "run-s02-events-streaming-golden",
        "expected_event_count": 7,
        "focus_event_types": ["model.request", "model.response", "session.stop"]
      },
      "agent_bridge": {
        "relationship": "direct",
        "claim_ids": ["codex-source-event-stream", "pi-source-session-events", "reasonix-source-event-log"],
        "notes": {"zh-CN": "对照重点是事件边界和可消费协议，不把 UI 流式效果误当成内部事件模型。", "en": "The comparison focuses on event boundaries and consumable protocols, not on inferring internals from streaming UI behavior."}
      },
      "exercise_checks": [
        {
          "id": "s02-golden-trace",
          "level": "observe",
          "title": {"zh-CN": "复核 Streaming Trace", "en": "Verify the streaming trace"},
          "acceptance": {"zh-CN": "三个 delta 形成三个有序事件，且最后一个明确标记 final。", "en": "Three deltas produce three ordered events and the last is explicitly final."},
          "command": "python3 -m curriculum.golden verify s02-events-streaming"
        },
        {
          "id": "s02-message-contract",
          "level": "modify",
          "title": {"zh-CN": "验证流式消息合同", "en": "Test the streaming message contract"},
          "acceptance": {"zh-CN": "增量可回放，同时不会污染下一轮的消息历史。", "en": "Deltas remain replayable without polluting the next-turn message history."},
          "command": "python3 -m unittest curriculum.tests.test_vertical_slice.VerticalSliceTests.test_s02_streaming_becomes_events -v"
        }
      ]
    },
    {
      "id": "s03-tool-dispatch",
      "number": "03",
      "slug": "tool-dispatch",
      "title": {"zh-CN": "Tool Registry 与 Dispatch", "en": "Tool Registry and Dispatch"},
      "summary": {"zh-CN": "验证、执行并记录模型请求的工具调用。", "en": "Validate, execute, and record model-requested tool calls."},
      "mechanism_ids": ["agent-loop", "tool-dispatch"],
      "status": "implemented",
      "estimated_minutes": 30,
      "difficulty": "intermediate",
      "code_path": "curriculum/lessons/s03_tool_dispatch/demo.py",
      "content_paths": {"zh-CN": "curriculum/lessons/s03_tool_dispatch/lesson.zh.md", "en": "curriculum/lessons/s03_tool_dispatch/lesson.en.md"},
      "run": "python3 -m curriculum.lessons.s03_tool_dispatch.demo",
      "change_contract": {
        "previous_lesson_id": "s02-events-streaming",
        "summary": {"zh-CN": "在不改变循环所有权的前提下加入结构化 Tool Roundtrip。", "en": "Add a structured tool roundtrip without changing ownership of the loop."},
        "adds": [
          {"zh-CN": "Tool Registry、参数校验与 dispatch", "en": "Tool registry, argument validation, and dispatch"},
          {"zh-CN": "tool.request 与 tool.result 的可追踪配对", "en": "Traceable pairing of tool.request and tool.result"}
        ],
        "preserves": [
          {"zh-CN": "模型只能请求动作；Harness 决定是否以及如何执行。", "en": "The model only requests actions; the harness decides whether and how to execute them."}
        ]
      },
      "golden_trace": {
        "path": "curriculum/lessons/s03_tool_dispatch/golden.trace.jsonl",
        "run_id": "run-s03-tool-dispatch-golden",
        "expected_event_count": 9,
        "focus_event_types": ["model.response", "tool.request", "tool.result", "model.request"]
      },
      "agent_bridge": {
        "relationship": "direct",
        "claim_ids": ["codex-source-tool-router", "pi-source-tool-dispatch", "reasonix-source-tool-dispatch", "reference-harness-controlled-tool-roundtrip"],
        "notes": {"zh-CN": "Vendor 源码 Claim 与可复现 reference baseline 分开呈现；后者不是 Native Agent 证据。", "en": "Vendor source claims are shown separately from the reproducible reference baseline, which is not native-agent evidence."}
      },
      "exercise_checks": [
        {
          "id": "s03-golden-trace",
          "level": "observe",
          "title": {"zh-CN": "复核 Tool Roundtrip", "en": "Verify the tool roundtrip"},
          "acceptance": {"zh-CN": "request、result 与第二次模型请求按因果顺序出现。", "en": "The request, result, and second model request appear in causal order."},
          "command": "python3 -m curriculum.golden verify s03-tool-dispatch"
        },
        {
          "id": "s03-dispatch-contract",
          "level": "modify",
          "title": {"zh-CN": "验证 Dispatch 合同", "en": "Test the dispatch contract"},
          "acceptance": {"zh-CN": "工具结果以绑定 tool_call_id 的 tool message 返回下一轮。", "en": "The tool result returns to the next turn as a tool message bound to tool_call_id."},
          "command": "python3 -m unittest curriculum.tests.test_vertical_slice.VerticalSliceTests.test_s03_tool_roundtrip -v"
        }
      ]
    },
    {
      "id": "s04-workspace-tools",
      "number": "04",
      "slug": "workspace-tools",
      "title": {"zh-CN": "File、Shell 与 Edit Tools", "en": "File, Shell, and Edit Tools"},
      "summary": {"zh-CN": "为副作用工具建立工作区路径边界和显式 allowlist。", "en": "Put workspace boundaries and explicit allowlists around side-effecting tools."},
      "mechanism_ids": ["workspace-tools", "path-boundary"],
      "status": "implemented",
      "estimated_minutes": 34,
      "difficulty": "intermediate",
      "code_path": "curriculum/lessons/s04_workspace_tools/demo.py",
      "content_paths": {"zh-CN": "curriculum/lessons/s04_workspace_tools/lesson.zh.md", "en": "curriculum/lessons/s04_workspace_tools/lesson.en.md"},
      "run": "python3 -m curriculum.lessons.s04_workspace_tools.demo",
      "change_contract": {
        "previous_lesson_id": "s03-tool-dispatch",